question,keywords,answer
Key initiatives and programs - commercialization of research and innovation at the University of Ibadan,key initiatives and programs; commercialization of research and innovation; University of Ibadan; UI,"{'description': 'UI has a dedicated committee to commercialize patents and intellectual properties developed by researchers.', 'collaborations': 'The university partners with businesses and research funders to translate innovations into practical applications.', 'focus_areas': ['Agriculture', 'Energy', 'Health', 'Infrastructure']}"
Key initiatives and programs - university of ibadan research foundation uirf at the University of Ibadan,key initiatives and programs; university of ibadan research foundation uirf; Academic grants; Scholarly support; Research funding; University of Ibadan Research Foundation UI; Geo Hackathon; international innovation conference,"{'Research Projects': 'Funds interdisciplinary research projects addressing national development challenges.', 'focus_areas': ['Agriculture', 'Energy', 'Health', 'Water Resources']} | {'College of Medicine': 'College of Medicine', 'description': 'Engages medical students in research through structured programs, mentorship, and faculty collaborations.', 'goal': 'Builds a strong research culture while addressing critical health challenges.'} | {'Geo Hackathons': ""Collaborates with Oyo State's Urban Renewal Project."", 'focus': 'Uses geospatial data for urban resilience solutions, including flood risk management and urban planning.'} | {'International Innovation Conference event': 'Held during UI’s 75th anniversary in 2024.', 'theme': 'Research, Innovation, and Sustainable Development.', 'goal': 'Fosters global partnerships between academia, industry, and policymakers.'}"
Focus areas of innovation at the University of Ibadan,focus areas of innovation; areas of innovation; innovation focus,Agriculture | Energy | Health | Infrastructure
Distance learning centre (DLC) at the University of Ibadan,distance learning centre; dlconline learning platforms and resources; online learning; coursera; Online Library,"{'DLC': 'UI operates an Open Distance eLearning (ODeL) mode through its Distance Learning Centre (UIDLC).', 'courses_offered': 'Various faculties including Arts, Science, Education, Law, and Social Sciences.', 'learning_management_system': 'Students access materials via the UIDLC LMS for remote learning.', 'Coursera': 'UI partners with Coursera to offer free access to over 3,800 courses.', 'eligibility': 'Students and staff can enroll using their institutional email (@stu.ui.edu.ng).'} | {'Online Library': 'The Kenneth Dike Library provides various digital resources.', 'resources': ['Online Public Access Catalogue (OPAC)', 'Online books and journals', 'Internet archives', 'CD-ROM databases', 'Reference materials'], 'accessibility': 'Available both on-campus and remotely for distance learners.'}"
Features of online learning resources - interactivity at the University of Ibadan,interactivity; features of online learning,"Platforms include discussion forums, quizzes, and live sessions."
How to access online resources - uidlc_student_portal at the University of Ibadan,how to access online resources; online resources; dlc student portal,"{'url': 'https://dlcportal.ui.edu.ng/login', 'login_details': 'Matriculation number or registered email address.', 'instructions': 'Use @stu.ui.edu.ng email to enroll for free courses.', 'access_method': 'Available through Kenneth Dike Library’s digital platforms.', 'technical_support': 'For LMS or email issues, contact lmssupport@ui.edu.ng.'}"
Free wifi services - availability at the University of Ibadan,free wifi services; free wifi; wifi availaibility,"All halls of residence (may not function optimally). | All 13 faculties, covering 75% of the 107 departments. | Main library (a small fee may be required)."
Paid wifi services - locations at the University of Ibadan,paid wifi services; paid wifi; wifi service,Main library | A small fee is charged for access. | Wi-Fi access points are distributed across academic and administrative areas.
Concentration at the University of Ibadan,access points; concentration points,Faculty Libraries | Kenneth Dike Library (KDL)
Wifi performance at the University of Ibadan,wifi performance; wifi challenges,Free Wi-Fi in halls of residence may not function optimally.
Power supply at the University of Ibadan,power supply challenges,Unstable power supply affects connectivity.
Bandwidth limitations at the University of Ibadan,bandwidth limitations,Bandwidth is limited due to reliance on middlemen rather than direct providers.
future plans - consideration at the University of Ibadan,future plans,The university administration is exploring implementing fully functional paid Wi-Fi services for students.
Innovate UK Business Connect at the University of Ibadan,Innovationuk business; key partnerships,"{'focus': 'Commercialization of research and innovation outcomes.', 'details': 'UI collaborates with Innovate UK to commercialize patents and intellectual property, supporting national development through innovation.'}"
Huawei Technologies at the University of Ibadan,key partnerships; huawei,"{'focus': 'ICT training and job opportunities.', 'details': 'Huawei organizes job fairs, campus talks, and certification programs to bridge the digital skills gap and enhance employability.'}"
"Infinix, UNESCO, and Google at the University of Ibadan",Google; Infinix; unesco; key partnerships,"{'focus': 'STEM education and AI/robotics training.', 'details': 'Through the CogLabs workshop, students engage in AI programming, robotics training, and hands-on STEM education using innovative tools.'}"
Small and Medium Enterprises (SMEs) at the University of Ibadan,medium Enterprises; small Enterprises; key partnerships,"{'focus': 'Entrepreneurship development.', 'details': 'UI collaborates with SMEs to promote business incubation through mentorship, networking, and entrepreneurship fairs.'}"
OPay Scholarship Initiative at the University of Ibadan,key partnerships; opay scholarship,"{'focus': 'Education funding.', 'details': 'OPay provides a 10-year scholarship program to support financially underprivileged but talented students.'}"
Technology infrastructure development - Infinix ICT Student Resource Centre at the University of Ibadan,technology infrastructure development; ict; infinix,"{'focus': 'Technological excellence.', 'details': 'Renovated by Infinix to host AI, robotics, and emerging tech workshops.'}"
technology_infrastructure_development - Public-Private Partnerships (PPP) at the University of Ibadan,technology infrastructure development; public private; ppp,"{'focus': 'Infrastructure development.', 'details': ""Collaborations with private entities enhance UI's ICT learning facilities.""}"
Opportunities for students - job fairs and career development at the University of Ibadan,job fairs and careercdevelopment; opportunities for students; Huawei,Huawei job fairs offering direct employment opportunities. | SME networking events for entrepreneurship.
Opportunities for students - scholarships at the University of Ibadan,Opay scholarship; opportunities for students,OPay’s 10-year scholarship program for talented students.
